Claim ID,Proposed claim,Grade,Internal evidence,Literature evidence,Statistical strength,Main limitation,Allowed location,Figure/Table,Config,Script,Report,Commit
A,"The present gated-ICCD folders exhibit substantial differences in operational repeated-frame noise statistics.",C1,"E1 mean/temporal/Fano/stable-component robustness; spatial PSD/autocorrelation; E6 drift and correlation audit","Sandel & Broadfoot 1986; Williams & Shaddix 2007; Pelaez et al. 2012; Wang et al. 2026","Ranges exceed median crop/frame sensitivity across ten folders","Folder/scene identity is confounded; no matched dark/flat; stable component is not uniquely FPN","Abstract;Contributions;Main Results;Limitations","Figure 2;Table 1","configs/e6_repeated_frame_audit.yaml","scripts/evaluate_noise_robustness.py;scripts/fit_mean_variance_curve.py;scripts/analyze_iccd_spatial_correlation.py;scripts/audit_repeated_frame_supervision.py","reports/gated_iccd_20260319_noise_robustness;reports/gated_iccd_20260319_spatial_correlation;reports/e6_repeated_frame_audit","31f77c8"
B,"The unified synthetic priors tested in this study did not transfer reliably to the present real-surrogate task.",C1,"E5 four cells all negative; three seeds; two references; prior gate gain below seed variability","Plotz & Roth 2017; Zhang et al. 2021; Han et al. 2021; Luo et al. 2025","P-L -0.496 dB; P-H -4.315; H-L -1.892; H-H -4.891; max seed SD 0.668 dB","Applies only to tested priors, small CNN, data batch, and surrogate references","Abstract;Contributions;Main Results;Discussion;Limitations","Figure 3;Table 2","configs/e5_noise_factorial.yaml","scripts/build_factorial_noise_dataset.py;scripts/validate_factorial_noise_dataset.py;scripts/train_manifest_denoiser_baseline.py;scripts/evaluate_factorial_probe.py;scripts/analyze_factorial_probe_effects.py","reports/e5_noise_factorial/factor_analysis/factorial_effect_report.md","9211521"
C,"Within the frozen E5 protocol, larger residual-strength mismatch is associated with poorer folder-level surrogate transfer.",C1,"E8 exact block permutation; LOO; seed/reference sensitivity; gradient partial rank; negative control; bootstrap","Plotz & Roth 2017 and Zhang et al. 2021 support transfer-based simulator validation; no direct ICCD equivalent identified","Mean rho -0.6061; p=0.00293; LOO 10/10 negative; seed/reference 6/6 negative; partial rho -0.5077","Narrow C1: n=10; bootstrap [-0.500,0.000]; H-L rho -0.2485; observational and device-specific","Abstract;Contributions;Main Results;Discussion;Limitations","Figure 4;Table 3","configs/e8_mismatch_transfer_linkage.yaml","scripts/analyze_e8_mismatch_transfer_linkage.py","reports/e8_mismatch_transfer_linkage/e8_mismatch_transfer_linkage_report.md","fd07752"
D,"The current radial-PSD mismatch metric did not show the preregistered negative association with transfer.",C2,"E8 spatial metric reliability and association outputs","Zhang et al. 2021; Fu et al. 2023 provide counter-evidence that spatial/local correlation can matter","Mean rho +0.3455; p=0.1890; only 1/4 variant negative","Metric-specific null; cannot infer spatial structure is unimportant","Main Results;Discussion;Limitations;Supplementary","Figure 4;Table 3","configs/e8_mismatch_transfer_linkage.yaml","scripts/analyze_e8_mismatch_transfer_linkage.py","reports/e8_mismatch_transfer_linkage/e8_mismatch_transfer_linkage_report.md","fd07752"
E,"Higher synthetic residual strength increased oversmoothing risk in the fixed small-CNN probe.",C2,"E5 gradient/noisy ratios, negative PSNR transfer, residual and error panels","Han et al. 2021 reports mismatch-related degradation in ICMOS; general real-denoising literature motivates edge-preservation audit","High cells gradient ratios 0.3515/0.4009 versus low cells 0.5697/0.5305","Small CNN only; gradient ratio is an operational oversmoothing indicator, not recovered-detail ground truth","Main Results;Discussion;Limitations","Figure 5;Table 2","configs/e5_noise_factorial.yaml","scripts/evaluate_factorial_probe.py;scripts/analyze_factorial_probe_effects.py","reports/e5_noise_factorial/factor_analysis/factorial_effect_report.md;reports/e5_noise_factorial/training/*/real_eval/panels","9211521"
F,"The present ten-folder dataset does not satisfy a universal naive Noise2Noise repeated-frame protocol.",C2,"E6 only 2/10 folders pass; pixel/bin/row/column correlations, drift, stable maps; low high-frequency correlation","Lehtinen et al. 2018; Batson & Royer 2019; Lee et al. 2022; Jang et al. 2023","Frozen eligibility gate passes 2/10 folders","Does not apply to all ICCD data; high-frequency/local self-supervision remains untested","Discussion;Limitations;Supplementary","Table 1","configs/e6_repeated_frame_audit.yaml;configs/e6_repeated_frame_protocol.yaml","scripts/audit_repeated_frame_supervision.py;scripts/build_repeated_frame_lofo_manifests.py;scripts/check_repeated_frame_lofo_leakage.py","reports/e6_repeated_frame_audit/repeated_frame_audit_report.md;reports/e6_repeated_frame_protocol/lofo_fold_summary.csv","04708d6"
G,"The exploratory gate/blend gives a stable deployable condition policy.",C3,"E4 advantage about 0.036 dB; E5 seed SD up to 0.668 dB; E7 condition score confounded","Noise Flow 2019 shows validated conditioning requires actual condition labels and real noise data","Effect is below seed variability and test folders informed earlier diagnostic rules","Exploratory only; no deployment or contribution claim","Discussion;Limitations;Supplementary","Supplementary","configs/e4_surrogate_reference_reliability.yaml","scripts/audit_surrogate_reference_reliability.py;scripts/evaluate_lofo_condition_protocol.py","reports/e4_surrogate_reference_reliability;docs/e7_data_route_literature_audit.md","985d4aa;31f77c8"
H,"The study identifies physical noise mechanisms, recovers true detail, predicts performance, or generalizes to other ICCDs.",C4,"No supporting calibrated acquisition or independent device validation","Direct ICCD calibration literature shows dark/flat, controlled flux, gain, ENF, uniformity, and response measurements are required","Unsupported","No clean ground truth, matched calibration, causal intervention, predictor validation, or external camera","Prohibited","None","None","None","None","31f77c8;fd07752"
